{
  "schema_version": "hot_packet_v0",
  "type": "hot_packet",
  "paper_only": true,
  "byte_cap": 8192,
  "l1_spine": {
    "signature": "SigExampleSealed",
    "mint": "MintExampleSealed",
    "txType": "create",
    "stream": "subscribeNewToken",
    "source": "pumpportal_ws",
    "commitment": "processed",
    "stage": "bonding",
    "traderPublicKey": "TraderExampleWeakWs",
    "name": "Example",
    "symbol": "EX",
    "uri": "https://example.invalid/meta.json",
    "bondingCurveKey": "CurveExample",
    "initialBuy": 1000.0,
    "solAmount": 0.1,
    "vTokensInBondingCurve": 1000000.0,
    "vSolInBondingCurve": 30.0,
    "marketCapSol": 30.0,
    "pool": null
  },
  "regime": {
    "regime_id": "env=mainnet|source=pumpportal_ws|stream=subscribeNewToken|stage=bonding|quote=wsol_assumed|commitment=processed|venue=pump_program|instr=pending_rpc|fee=unverified|market=bonding_curve",
    "components": {
      "env": "mainnet",
      "source": "pumpportal_ws",
      "stream": "subscribeNewToken",
      "stage": "bonding",
      "quote": "wsol_assumed",
      "commitment": "processed",
      "venue": "pump_program",
      "instr": "pending_rpc",
      "fee": "unverified",
      "market": "bonding_curve"
    },
    "component_lock": {
      "env": "production",
      "source": "production",
      "stream": "production",
      "stage": "production",
      "quote": "production",
      "commitment": "production",
      "venue": "production",
      "instr": "production",
      "fee": "production",
      "market": "production"
    }
  },
  "knowable_at_t": {
    "quote": "wsol_assumed",
    "quote_verified": false,
    "instr": "pending_rpc",
    "fee": "unverified",
    "venue": "pump_program",
    "venue_verified": false,
    "creator_verified": false,
    "reserves_source": "ws"
  },
  "graph": {
    "cold": true,
    "max_slots": 5,
    "lane_policy": "exp004_capped_scalars_only",
    "slots": null
  },
  "clocks": {
    "t_ws": "2026-09-20T12:00:00.000+00:00",
    "t_event": null,
    "T_decision": "2026-09-20T12:00:00.000+00:00",
    "t_precompute_as_of": "2026-09-20T12:00:00.000+00:00",
    "precompute_features_merged": false,
    "clock_source": "dec005_draft_pr8_unmerged"
  },
  "delta_exec": {
    "defined_in": "dec005_draft_pr8_unmerged",
    "value": null,
    "reason": "paper_packet_has_no_fill"
  },
  "provenance": {
    "spine": "sealed_jsonl",
    "source_day": "2026-09-20",
    "parent_type": "ingest_hot",
    "parent_schema": "observe_hot_v0",
    "parent_signature": "SigExampleSealed",
    "mint": "MintExampleSealed",
    "fixture_origin": "synthetic",
    "supersedes": null,
    "day_aligned": true
  },
  "dual_read": {
    "overlay": "sealed",
    "sealed_book_rpc_slice": "incomplete",
    "enrich_type": null
  },
  "honesty": {
    "registration": "proposed",
    "continuous_observe_wiring": false,
    "encoder_promoted": false,
    "enum_production_lock": false,
    "discovery_promoted": false,
    "graph_lane_revived": false,
    "invented_lift": false
  }
}
